{
  "$schema": "./schemas/palette.schema.json",
  "config_name": "palette",
  "version": "2.0.0",
  "spec_reference": "sinking-ship-master-spec.md Section 7 (palette discipline); art direction from docs/art-reference/",
  "notes": [
    "v2.0.0 re-anchored on the owner-supplied Amano-style references (docs/art-reference/pirate-ship/ and tom-bepe-amano/): flowing ink line-art with a vertical colour gradient that fades into deep navy, on a bone-white ground.",
    "THE ORGANISING IDEA: gradient hue encodes depth. Crimson / fire / blood sit at the Surface (despair); the ramp cools through gold and violet into deep navy and ink at the Hadal floor. Chia-green and gold are the recurring accent hues (the Chia-coded pieces, treasure light).",
    "One 32-colour master palette; every sprite snaps to it. Six 12-colour zone sub-palettes (strict subsets of the master); background layers (sky, sea) snap to the NFT's zone sub-palette.",
    "STYLE CAVEAT / OQ-11: the references are fine-line anti-aliased illustration; the spec mandates 48x48 no-anti-alias pixel art. This palette serves the pixel pipeline (a limited, snap-able ramp set) while carrying the references' hues. Whether final art stays 48x48 pixel, becomes Amano line-art, or a hybrid is the open medium decision — see docs/art-reference/ART-DIRECTION.md.",
    "Working palette: swap any hex freely; render_engine and validators read only this file."
  ],
  "master": [
    {"name": "ink_black",    "hex": "#0d0d16"},
    {"name": "shadow_navy",  "hex": "#0a1428"},
    {"name": "deep_ink",     "hex": "#14183a"},
    {"name": "abyss_navy",   "hex": "#101a40"},
    {"name": "deep_navy",    "hex": "#1a2a5c"},
    {"name": "navy",         "hex": "#26407a"},
    {"name": "sea_blue",     "hex": "#3a5f9e"},
    {"name": "steel_blue",   "hex": "#6f92c4"},
    {"name": "pale_blue",    "hex": "#a9c6e6"},
    {"name": "maroon",       "hex": "#6e1622"},
    {"name": "blood_red",    "hex": "#a01f2e"},
    {"name": "crimson",      "hex": "#c8323f"},
    {"name": "coral",        "hex": "#e35d5b"},
    {"name": "rose_ash",     "hex": "#d98a8a"},
    {"name": "ember_orange", "hex": "#d0542a"},
    {"name": "bronze",       "hex": "#7a4a1e"},
    {"name": "amber",        "hex": "#b3742a"},
    {"name": "gold",         "hex": "#d99a3c"},
    {"name": "pale_gold",    "hex": "#ecc873"},
    {"name": "sand",         "hex": "#f0dca8"},
    {"name": "deep_teal",    "hex": "#0f4a44"},
    {"name": "teal_green",   "hex": "#1c7a5e"},
    {"name": "chia_green",   "hex": "#2fa86a"},
    {"name": "bright_green", "hex": "#52c47e"},
    {"name": "pale_green",   "hex": "#a6e0b0"},
    {"name": "deep_violet",  "hex": "#2e1a4d"},
    {"name": "violet",       "hex": "#4a2a6e"},
    {"name": "amethyst",     "hex": "#7a4aa8"},
    {"name": "lavender",     "hex": "#b79ad6"},
    {"name": "slate_gray",   "hex": "#6b6b80"},
    {"name": "ash_gray",     "hex": "#b8b8c4"},
    {"name": "bone_white",   "hex": "#f4f4f0"}
  ],
  "zones": {
    "surface":  ["bone_white", "ash_gray", "slate_gray", "pale_blue", "steel_blue",
                 "crimson", "coral", "blood_red", "ember_orange", "sand", "gold", "deep_navy"],
    "sunlight": ["pale_blue", "steel_blue", "sea_blue", "navy", "gold", "amber",
                 "pale_gold", "sand", "bronze", "chia_green", "bone_white", "slate_gray"],
    "twilight": ["deep_ink", "deep_navy", "navy", "sea_blue", "deep_violet", "violet",
                 "amethyst", "lavender", "crimson", "rose_ash", "slate_gray", "ash_gray"],
    "midnight": ["ink_black", "deep_ink", "abyss_navy", "deep_navy", "navy", "teal_green",
                 "chia_green", "bright_green", "deep_violet", "violet", "slate_gray", "steel_blue"],
    "abyssal":  ["shadow_navy", "ink_black", "deep_ink", "abyss_navy", "slate_gray",
                 "ember_orange", "bronze", "amber", "maroon", "teal_green", "gold", "ash_gray"],
    "hadal":    ["ink_black", "deep_ink", "abyss_navy", "deep_violet", "violet", "amethyst",
                 "chia_green", "bright_green", "gold", "pale_gold", "bone_white", "teal_green"]
  },
  "background_layers": ["sky", "sea"]
}
